{
    "$schema": "http://json-schema.org/draft-07/schema#",
    "$id": "mod_manifest.schema.json",
    "title": "Mod Manifest",
    "description": "Schema for mod.json (mod-level metadata). This is separate from scenario metadata.",
    "type": "object",
    "required": ["id", "displayName", "version"],
    "properties": {
        "id": {
            "type": "string",
            "minLength": 1,
            "description": "Unique mod identifier (reverse-domain recommended)"
        },
        "displayName": {
            "type": "string",
            "minLength": 1,
            "description": "Display name shown in mod browser"
        },
        "iconPath": {
            "type": "string",
            "description": "Relative path to a mod icon image (required if specified in code/UI). When declared, this path is used exclusively — no implicit fallbacks to root icon.png or other defaults."
        },
        "thumbnailPath": {
            "type": "string",
            "description": "Relative path to a larger mod thumbnail/preview image (required if specified in code/UI). When declared, this path is used exclusively — no implicit fallbacks."
        },
        "era": {
            "type": "string",
            "description": "Optional era tag for sorting/grouping"
        },
        "startYear": {
            "type": "integer",
            "minimum": 0,
            "description": "Optional suggested start year for UI metadata"
        },
        "version": {
            "type": "string",
            "minLength": 1,
            "description": "Mod version, semver MAJOR.MINOR.PATCH (e.g. 1.0.0). Dependencies written as id@range are matched against it, and Validate reports a version that is not semver."
        },
        "description": {
            "type": "string"
        },
        "workshopItemId": {
            "type": "string",
            "description": "Steam Workshop item id when applicable"
        },
        "defaultScenarioFile": {
            "type": "string",
            "description": "Relative path to single-file scenario json"
        },
        "scenarioFolder": {
            "type": "string",
            "description": "Relative path to split scenario folder; takes precedence over defaultScenarioFile"
        },
        "entrypoints": {
            "type": "object",
            "description": "Optional explicit entrypoint declarations for runtime assets.",
            "properties": {
                "wasm": {
                    "type": "string",
                    "description": "Relative path to mod WASM entrypoint. Loader checks this first, then falls back to scripts/main.wasm for legacy mods."
                },
                "ui": {
                    "type": "string",
                    "description": "Relative path to UI injection descriptor. Loader checks this first, then falls back to ui/panels.json for legacy mods."
                }
            },
            "additionalProperties": false
        },
        "enabledByDefault": {
            "type": "boolean",
            "default": false
        },
        "wasmAbiVersion": {
            "type": "integer",
            "minimum": 1,
            "default": 1
        },
        "enableComponentRuntime": {
            "type": "boolean",
            "default": false,
            "description": "Explicit opt-in to allow loading component-model WASM artifacts for this mod. Keep false unless the mod ships component-model binaries and the game runtime has a component backend enabled."
        },
        "runtimePolicy": {
            "type": "string",
            "enum": ["coexist", "wasm_only", "csharp_only"],
            "default": "coexist",
            "description": "Declares how this mod's runtime components coexist. coexist=WASM and C# run together (default). wasm_only=refuse to subscribe if C# hooks already registered. csharp_only=skip WASM loading for this mod."
        },
        "managedSdkVersion": {
            "type": "string",
            "pattern": "^[0-9]+\\.[0-9]+$",
            "description": "Optional. Declares which managed SDK version this mod's C# DLLs were compiled against. Format: MAJOR.MINOR (e.g. '1.0'). Major version must match the game's ManagedSdkVersion. Omit if the mod ships no managed DLLs (WASM-only mods can omit this)."
        },
        "permissions": {
            "type": "array",
            "items": {
                "type": "string",
                "enum": [
                    "ReadEconomy",
                    "WriteTreasury",
                    "FireTriggers",
                    "WriteFlags",
                    "InjectUI",
                    "read_economy",
                    "write_treasury",
                    "fire_triggers",
                    "write_flags",
                    "inject_ui"
                ]
            },
            "uniqueItems": true,
            "description": "Requested mod permissions"
        },
        "author": {
            "type": "string",
            "description": "Author name shown to players. Informational."
        },
        "tags": {
            "type": "array",
            "items": {
                "type": "string",
                "minLength": 1
            },
            "uniqueItems": true,
            "description": "Free-form category tags (e.g. \"scenario\", \"balance\"). Informational: they never change how the mod loads."
        },
        "gameVersion": {
            "type": "string",
            "description": "Semver range of game versions the mod was made for, e.g. \"^0.5.0\" or \">=0.5.0 <0.7.0\". Outside it the Mods panel warns and the mod still loads."
        },
        "dependencies": {
            "type": "array",
            "items": {
                "type": "string",
                "minLength": 1,
                "pattern": "^[^@\\s]+(@.+)?$"
            },
            "uniqueItems": true,
            "description": "Mods that must be enabled for this one to load: a mod id, or id@range to require a version range (e.g. \"example.base@^1.2.0\"). Dependencies always load first. A dependency that is not installed, not enabled, outside the range or unable to load stops this mod from loading and is reported on the Mods panel; so is a dependency cycle."
        },
        "loadOrderHint": {
            "type": "integer",
            "default": 0,
            "description": "Load position among mods that do not depend on each other: lower loads first, higher loads later and wins conflicting overrides. An engine event id is the exception: it stays with the first mod in load order, and a later mod's event with the same id is skipped. Ties load in mod id order. Default 0."
        }
    },
    "additionalProperties": false
}
