{
  "id": "globalprotocol.old_world_order",
  "displayName": "Global Protocol: Old World Order",
  "iconPath": "logo.png",
  "thumbnailPath": "thumbnail.png",
  "era": "1450",
  "startYear": 1450,
  "version": "0.8.0",
  "workshopItemId": "3724318324",
  "description": "A historical scenario set in 1450 AD. Play as one of 137 nations from the late medieval period, commanding historically accurate armies, fleets, governments, and ambitions. Featuring the Ottoman Empire, Ming Dynasty, Portugal, France, England, Muscovy, the Timurids, and more.",
  "scenarioFolder": "scenario",
  "enabledByDefault": false,
  "wasmAbiVersion": 3,
  "runtimePolicy": "coexist",
  "enableComponentRuntime": true,
  "permissions": ["InjectUI", "FireTriggers"],
  "entrypoints": {
    "wasm": "Content/mod.wasm",
    "ui": "Content/ui/inject.json"
  }
}
